[
  {
    "id": "badge-first-look",
    "title": {
      "ko": "첫 관측 기록"
    },
    "description": {
      "ko": "직접 본 천체를 기록했습니다. 다음에는 관측 조건도 한 줄 남겨 보세요."
    },
    "icon": "⭐",
    "rule": {
      "key": "firstObservation"
    }
  },
  {
    "id": "badge-first-sketch",
    "title": {
      "ko": "선으로 남긴 하늘"
    },
    "description": {
      "ko": "첫 스케치를 저장했습니다. 다음에는 같은 대상의 다른 날 모습과 비교해 보세요."
    },
    "icon": "✏️",
    "rule": {
      "key": "firstSketch"
    }
  },
  {
    "id": "badge-first-hop",
    "title": {
      "ko": "별을 이어 가는 길"
    },
    "description": {
      "ko": "첫 스타 호핑을 마쳤습니다. 다음에는 같은 경로를 다시 찾아 보세요."
    },
    "icon": "👣",
    "rule": {
      "key": "firstStarHop"
    }
  },
  {
    "id": "badge-two-star-check",
    "title": {
      "ko": "두 별로 맞춘 방향"
    },
    "description": {
      "ko": "두 별 정렬을 마쳤습니다. 다음에는 다른 방향에서 오차를 확인해 보세요."
    },
    "icon": "🧭",
    "rule": {
      "key": "align2Success"
    }
  },
  {
    "id": "badge-missions-3",
    "title": {
      "ko": "세 번의 관측 연습"
    },
    "description": {
      "ko": "세 미션을 마쳤습니다. 다음에는 다른 종류의 관측 행동을 골라 보세요."
    },
    "icon": "🌱",
    "rule": {
      "key": "missionsCompleted",
      "n": 3
    }
  },
  {
    "id": "badge-missions-6",
    "title": {
      "ko": "관측 습관의 시작"
    },
    "description": {
      "ko": "여섯 미션을 마쳤습니다. 다음에는 같은 천체를 다른 장비로 비교해 보세요."
    },
    "icon": "🌿",
    "rule": {
      "key": "missionsCompleted",
      "n": 6
    }
  },
  {
    "id": "badge-missions-12",
    "title": {
      "ko": "넓어진 관측 경험"
    },
    "description": {
      "ko": "열두 미션을 마쳤습니다. 다음에는 아직 시도하지 않은 계절을 살펴보세요."
    },
    "icon": "🌳",
    "rule": {
      "key": "missionsCompleted",
      "n": 12
    }
  },
  {
    "id": "badge-missions-24",
    "title": {
      "ko": "첫 학습 묶음 한 바퀴"
    },
    "description": {
      "ko": "서로 다른 미션 스물네 개를 마쳤습니다. 다음에는 남은 미션 중 오늘 조건에 맞는 대상을 골라 보세요."
    },
    "icon": "🗺️",
    "rule": {
      "key": "missionsCompleted",
      "n": 24
    }
  },
  {
    "id": "badge-quiz-3",
    "title": {
      "ko": "이어지는 세 정답"
    },
    "description": {
      "ko": "서로 다른 문제 3개를 연속으로 맞혔습니다. 다음에는 답의 이유를 관측과 연결해 보세요."
    },
    "icon": "💡",
    "rule": {
      "key": "quizStreak",
      "n": 3
    }
  },
  {
    "id": "badge-quiz-5",
    "title": {
      "ko": "설명을 연결하는 힘"
    },
    "description": {
      "ko": "서로 다른 문제 5개를 연속으로 맞혔습니다. 다음에는 답의 이유를 관측과 연결해 보세요."
    },
    "icon": "🔎",
    "rule": {
      "key": "quizStreak",
      "n": 5
    }
  },
  {
    "id": "badge-quiz-10",
    "title": {
      "ko": "다음 질문을 향해"
    },
    "description": {
      "ko": "서로 다른 문제 10개를 연속으로 맞혔습니다. 다음에는 답의 이유를 관측과 연결해 보세요."
    },
    "icon": "📚",
    "rule": {
      "key": "quizStreak",
      "n": 10
    }
  },
  {
    "id": "badge-constellations-2",
    "title": {
      "ko": "두 별자리의 길잡이"
    },
    "description": {
      "ko": "서로 다른 별자리 2개의 주요 배열을 직접 확인한 기록입니다. 다음에는 그 별자리 안의 성단이나 별을 따로 찾아보세요."
    },
    "icon": "✨",
    "rule": {
      "key": "constellationCount",
      "n": 2
    }
  },
  {
    "id": "badge-constellations-4",
    "title": {
      "ko": "네 방향의 별자리"
    },
    "description": {
      "ko": "서로 다른 별자리 4개의 주요 배열을 직접 확인한 기록입니다. 다음에는 그 별자리 안의 성단이나 별을 따로 찾아보세요."
    },
    "icon": "🌌",
    "rule": {
      "key": "constellationCount",
      "n": 4
    }
  },
  {
    "id": "badge-constellations-6",
    "title": {
      "ko": "더 넓은 별자리 지도"
    },
    "description": {
      "ko": "서로 다른 별자리 6개의 주요 배열을 직접 확인한 기록입니다. 다음에는 그 별자리 안의 성단이나 별을 따로 찾아보세요."
    },
    "icon": "🔭",
    "rule": {
      "key": "constellationCount",
      "n": 6
    }
  },
  {
    "id": "badge-summer-guide",
    "title": {
      "ko": "여름의 길잡이"
    },
    "description": {
      "ko": "세 꼭짓점을 실제로 관측했습니다. 다음에는 각 별이 속한 별자리를 연결해 보세요."
    },
    "icon": "🔺",
    "rule": {
      "key": "seasonSignature",
      "id": "summerTriangle"
    }
  },
  {
    "id": "badge-messier-three",
    "title": {
      "ko": "성운·성단으로 첫 확장"
    },
    "description": {
      "ko": "서로 다른 메시에 천체 세 개를 관측했습니다. 다음에는 종류가 다른 대상을 비교해 보세요."
    },
    "icon": "🌀",
    "rule": {
      "key": "messierCount",
      "n": 3
    }
  },
  {
    "id": "badge-messier-five",
    "title": {
      "ko": "다섯 가지 깊은 하늘"
    },
    "description": {
      "ko": "서로 다른 메시에 천체 다섯 개를 관측했습니다. 다음에는 산개성단과 구상성단의 인상을 비교해 보세요."
    },
    "icon": "🔬",
    "rule": {
      "key": "messierCount",
      "n": 5
    }
  },
  {
    "id": "badge-missions-30",
    "title": {
      "ko": "첫 과정의 다음 장"
    },
    "description": {
      "ko": "서로 다른 미션 서른 개를 마쳤습니다. 다음에는 같은 천체를 다른 계절·하늘 조건에서 다시 기록해 보세요."
    },
    "icon": "🌠",
    "rule": {
      "key": "missionsCompleted",
      "n": 30
    }
  }
]
